{
  "schema_version": 2,
  "channel_id": "skilled-scipkg",
  "updated_at": "2026-03-01T03:34:03.416400Z",
  "packages": [
    {
      "package_id": "abinit",
      "title": "ABINIT Electronic-Structure Suite",
      "description": "ABINIT is a first-principles atomic-scale simulation package for computing electronic, structural, vibrational, and dielectric properties of materials using DFT and related methods.",
      "upstream_repo_url": "https://github.com/abinit/abinit",
      "homepage_url": "https://www.abinit.org",
      "zip_url": "https://github.com/skilled-scipkg/abinit/archive/refs/heads/master.zip",
      "default_version": "branch-head",
      "versions": [
        {
          "version_id": "branch-head",
          "source_archive_url": "https://github.com/skilled-scipkg/abinit/archive/refs/heads/master.zip",
          "source_ref": {
            "type": "branch",
            "value": "master"
          },
          "verified": false
        }
      ],
      "tags": [
        "abinit",
        "dft",
        "electronic-structure",
        "materials-science",
        "dfpt",
        "first-principles"
      ]
    },
    {
      "package_id": "amuse",
      "title": "AMUSE Astrophysical Simulation Environment",
      "description": "AMUSE is a Python-driven framework that couples specialized community solvers to build multi-physics astrophysical simulations across gravitational dynamics, hydrodynamics, stellar evolution, and other computational astronomy research workflows.",
      "upstream_repo_url": "https://github.com/amusecode/amuse",
      "homepage_url": "http://www.amusecode.org",
      "zip_url": "https://github.com/skilled-scipkg/amuse/archive/refs/heads/main.zip",
      "default_version": "branch-head",
      "versions": [
        {
          "version_id": "branch-head",
          "source_archive_url": "https://github.com/skilled-scipkg/amuse/archive/refs/heads/main.zip",
          "source_ref": {
            "type": "branch",
            "value": "main"
          },
          "verified": false
        }
      ],
      "tags": [
        "amuse",
        "astrophysics",
        "computational_astronomy",
        "nbody",
        "hydrodynamics",
        "stellar_evolution"
      ]
    },
    {
      "package_id": "anndata",
      "title": "AnnData Annotated Data Matrices",
      "description": "anndata provides an efficient annotated matrix container for single-cell and spatial omics, supporting metadata-rich observations, variables, sparse storage, and on-disk workflows.",
      "upstream_repo_url": "https://github.com/scverse/anndata",
      "homepage_url": "http://anndata.readthedocs.io",
      "zip_url": "https://github.com/skilled-scipkg/anndata/archive/refs/heads/main.zip",
      "default_version": "branch-head",
      "versions": [
        {
          "version_id": "branch-head",
          "source_archive_url": "https://github.com/skilled-scipkg/anndata/archive/refs/heads/main.zip",
          "source_ref": {
            "type": "branch",
            "value": "main"
          },
          "verified": false
        }
      ],
      "tags": [
        "anndata",
        "single-cell",
        "omics",
        "bioinformatics",
        "h5ad"
      ]
    },
    {
      "package_id": "arbor",
      "title": "Arbor Neural Simulation Library",
      "description": "Arbor is a high-performance library for simulating morphologically detailed multi-compartment neuron and network models with performance portability across CPU and GPU architectures.",
      "upstream_repo_url": "https://github.com/arbor-sim/arbor",
      "homepage_url": "https://arbor-sim.org",
      "zip_url": "https://github.com/skilled-scipkg/arbor/archive/refs/heads/master.zip",
      "default_version": "branch-head",
      "versions": [
        {
          "version_id": "branch-head",
          "source_archive_url": "https://github.com/skilled-scipkg/arbor/archive/refs/heads/master.zip",
          "source_ref": {
            "type": "branch",
            "value": "master"
          },
          "verified": false
        }
      ],
      "tags": [
        "computational-neuroscience",
        "neuron-simulation",
        "electrophysiology",
        "multi-compartment",
        "hpc"
      ]
    },
    {
      "package_id": "arc",
      "title": "ARC Alkali Rydberg Calculator",
      "description": "Python toolkit for computing properties of highly excited Rydberg states and interactions in alkali and divalent atoms, including level structure, transition strengths, and electric-field Stark calculations.",
      "upstream_repo_url": "https://github.com/nikolasibalic/ARC-Alkali-Rydberg-Calculator",
      "homepage_url": "https://atomcalc.org",
      "zip_url": "https://github.com/skilled-scipkg/ARC-Alkali-Rydberg-Calculator/archive/refs/heads/master.zip",
      "default_version": "branch-head",
      "versions": [
        {
          "version_id": "branch-head",
          "source_archive_url": "https://github.com/skilled-scipkg/ARC-Alkali-Rydberg-Calculator/archive/refs/heads/master.zip",
          "source_ref": {
            "type": "branch",
            "value": "master"
          },
          "verified": false
        }
      ],
      "tags": [
        "atomic-physics",
        "rydberg-atoms",
        "alkali-atoms",
        "divalent-atoms",
        "quantum-optics",
        "stark-shifts"
      ]
    },
    {
      "package_id": "astropy",
      "title": "Astropy Astronomy Core Library",
      "description": "Astropy is the core Python library for astronomy, covering units, coordinates, time handling, FITS files, WCS, tables, and cosmology workflows.",
      "upstream_repo_url": "https://github.com/astropy/astropy",
      "homepage_url": "https://www.astropy.org",
      "zip_url": "https://github.com/skilled-scipkg/astropy/archive/refs/heads/main.zip",
      "default_version": "branch-head",
      "versions": [
        {
          "version_id": "branch-head",
          "source_archive_url": "https://github.com/skilled-scipkg/astropy/archive/refs/heads/main.zip",
          "source_ref": {
            "type": "branch",
            "value": "main"
          },
          "verified": false
        }
      ],
      "tags": [
        "astronomy",
        "astrophysics",
        "fits",
        "coordinates",
        "cosmology",
        "units"
      ]
    },
    {
      "package_id": "atomsmltr",
      "title": "atomSmltr Laser Cooling and Trapping Simulator",
      "description": "atomSmltr is a modular Python toolkit for simulating laser-cooled atoms in custom laser and magnetic field geometries with trajectory integration.",
      "upstream_repo_url": "https://github.com/adareau/atomSmltr",
      "homepage_url": "https://atomsmltr.readthedocs.io/en/latest/",
      "zip_url": "https://github.com/skilled-scipkg/atomSmltr/archive/refs/heads/main.zip",
      "default_version": "branch-head",
      "versions": [
        {
          "version_id": "branch-head",
          "source_archive_url": "https://github.com/skilled-scipkg/atomSmltr/archive/refs/heads/main.zip",
          "source_ref": {
            "type": "branch",
            "value": "main"
          },
          "verified": false
        }
      ],
      "tags": [
        "atomic-physics",
        "laser-cooling",
        "cold-atoms",
        "magneto-optical-trap",
        "numerical-simulation"
      ]
    },
    {
      "package_id": "batman",
      "title": "BATMAN Exoplanet Transit Light-Curve Modeler",
      "description": "BATMAN is a Python package for very fast computation of exoplanet transit light curves, supporting multiple limb-darkening laws for fitting and simulating planetary transit photometry.",
      "upstream_repo_url": "https://github.com/lkreidberg/batman",
      "homepage_url": "http://lkreidberg.github.io/batman",
      "zip_url": "https://github.com/skilled-scipkg/batman/archive/refs/heads/master.zip",
      "default_version": "branch-head",
      "versions": [
        {
          "version_id": "branch-head",
          "source_archive_url": "https://github.com/skilled-scipkg/batman/archive/refs/heads/master.zip",
          "source_ref": {
            "type": "branch",
            "value": "master"
          },
          "verified": false
        }
      ],
      "tags": [
        "astronomy",
        "exoplanets",
        "transit-light-curves",
        "photometry",
        "time-series"
      ]
    },
    {
      "package_id": "biopython",
      "title": "Biopython",
      "description": "Biopython provides Python tools for bioinformatics and computational molecular biology, covering biological sequence parsing, alignments, phylogenetics, and interfaces to common genomics and proteomics data sources.",
      "upstream_repo_url": "https://github.com/biopython/biopython",
      "homepage_url": "http://biopython.org/",
      "zip_url": "https://github.com/skilled-scipkg/biopython/archive/refs/heads/master.zip",
      "default_version": "branch-head",
      "versions": [
        {
          "version_id": "branch-head",
          "source_archive_url": "https://github.com/skilled-scipkg/biopython/archive/refs/heads/master.zip",
          "source_ref": {
            "type": "branch",
            "value": "master"
          },
          "verified": false
        }
      ],
      "tags": [
        "bioinformatics",
        "computational-biology",
        "molecular-biology",
        "sequence-analysis",
        "genomics"
      ]
    },
    {
      "package_id": "bloqade",
      "title": "Bloqade Neutral Atom Quantum SDK",
      "description": "Bloqade is QuEra's Python SDK and eDSL suite for programming, compiling, and simulating neutral-atom quantum computing workflows on Rydberg-atom hardware and related backends.",
      "upstream_repo_url": "https://github.com/QuEraComputing/bloqade",
      "homepage_url": "https://bloqade.quera.com/latest/",
      "zip_url": "https://github.com/skilled-scipkg/bloqade/archive/refs/heads/main.zip",